[
  {
    "appId": 100,
    "title": "Heat Pump",
    "description": "Clock-synced sidechain ducking: hold + log release",
    "icon": "ad-env",
    "color": "Pink",
    "text": "Clock-synced sidechain ducking envelope: on each division the CV ducks, holds briefly, then recovers with a logarithmic release.\n\n#### Patching\n- Patch **CV Out** to a filter or VCA\n- **MIDI CC** mirrors when Out is enabled\n\n#### Faders\n- **Main** — Release speed\n- **Shift + fader** — Depth\n- **Button + fader** — Clock division\n\n#### Buttons\n- **Short tap** — One manual duck\n- **Long press** — Mute without snapping to idle\n- **Shift + long** — Toggle invert",
    "channels": [
      {
        "jackTitle": "Jack",
        "jackDescription": "CV Out = duck envelope; CV In modulates Depth, Release, or triggers Duck.",
        "faderTitle": "Release",
        "faderDescription": "Log recovery after hold.",
        "faderPlusFnTitle": "Division",
        "faderPlusFnDescription": "Button + fader picks clock division.",
        "faderPlusShiftTitle": "Depth",
        "faderPlusShiftDescription": "Duck amount per division.",
        "fnTitle": "Trigger / mute",
        "fnDescription": "Short = manual duck; Long = mute.",
        "ledTop": "Envelope level",
        "ledBottom": "Division color on Button LED",
        "fnPlusShiftTitle": "Invert",
        "fnPlusShiftDescription": "Shift + long toggles invert."
      }
    ],
    "params": [
      "Color",
      "Range",
      "MIDI Channel",
      "MIDI CC",
      "MIDI NRPN",
      "MIDI Out",
      "Jack",
      "CV Dest",
      "CV Att"
    ],
    "storage": [
      "Release",
      "Depth",
      "Division",
      "Invert",
      "Muted"
    ]
  },
  {
    "appId": 101,
    "title": "Grooves",
    "description": "Multi-genre MIDI drum grooves with feel",
    "icon": "die",
    "color": "Orange",
    "text": "One-channel multi-genre drum helper with up to seven MIDI voices, clock-synced in 4/4.\n\n#### Parameters\n- **Groove** — Genre family\n- **Density** and **Feel** — Fills and character\n- **Drummer** — Personas (long press); ornament style\n- **Swing max %** — Caps swing depth (sign = direction)\n\n#### Jack\n- **Any/Stacked** — CV out\n- **CV in** — Density, Feel, or Reset\n\n#### Architecture\n- Clock-driven scheduling in a dedicated processor\n- MIDI sends in a separate task (`pending_*` isolation)",
    "channels": [
      {
        "jackTitle": "Jack output",
        "jackDescription": "Any: velocity-weighted pulse per hit. Stacked: 1 V kick, 2 V snare, 4 V hats.",
        "faderTitle": "Density",
        "faderDescription": "Reveals extra drum hits as ghosts.",
        "faderPlusFnTitle": "Feel",
        "faderPlusFnDescription": "Attenuates groove character.",
        "faderPlusShiftTitle": "Genre",
        "faderPlusShiftDescription": "Scrub pattern families.",
        "fnTitle": "Reset / Mute",
        "fnDescription": "Short: downbeat. Long: mute.",
        "fnPlusShiftTitle": "Reverse / Jack",
        "fnPlusShiftDescription": "Short: reverse swing. Long: Any vs Stacked.",
        "ledTop": "Bar position",
        "ledTopPlusShift": "Genre color",
        "ledTopPlusFn": "Feel (red)",
        "ledBottom": "Hit flash"
      }
    ],
    "params": [
      "MIDI Note Kick",
      "MIDI Note Snare",
      "MIDI Note Hats",
      "MIDI Note Open Hat",
      "MIDI Note Low Tom",
      "MIDI Note High Tom",
      "MIDI Note Clap",
      "MIDI Ch",
      "Ch Map",
      "Groove",
      "Swing max %",
      "GATE %",
      "MIDI Out",
      "Jack",
      "CV Att",
      "Drummer"
    ],
    "storage": [
      "Feel",
      "Density",
      "Muted",
      "Drummer"
    ]
  },
  {
    "appId": 104,
    "title": "Echolot",
    "description": "MIDI/CV delay with feedback and pitch shift",
    "icon": "sine",
    "color": "Cyan",
    "text": "MIDI/CV delay with feedback and optional pitch shift on each repeat.\n\n#### Behavior\n- Feedback and optional pitch intervals on repeats\n- **I/O** — MIDI↔CV routing\n- **Ping-Pong** — Alternates MIDI Out A/B (MIDI→MIDI and CV→MIDI)\n- **Mute** — Ring-out (block new input; queue rings out)\n- **Long Panic** — Clears the queue — skipped if you moved **Third** this hold\n- **MIDI/gate in** — White **button** flash (~20% peak when muted)\n\n#### Faders\n- **Main** — Delay (ms or clock ticks; up = shorter)\n- **Shift+Fader** — Feedback\n- **Button+Fader** — Interval per repeat (±24 semitones; Interval mode sets Fixed / Stack / Bounce)\n\n#### Buttons\n- **Short** — Mute (ring-out)\n- **Long** — Panic; skipped after Third edit this hold\n\n#### LEDs\n- Main layer: delay meter + activity pulse (Ping-Pong: Top = Out A · Bottom = Out B)\n- Alt: green feedback split · Third: red interval up/down\n- Input activity: white flash on **button** LED",
    "channels": [
      {
        "jackTitle": "CV",
        "jackDescription": "MIDI→CV: pitch/gate/CC out. CV→MIDI: gate or CV in. MIDI→MIDI: no jack.",
        "faderTitle": "Delay",
        "faderDescription": "Delay time (ms) or clock division — up = shorter.",
        "faderPlusShiftTitle": "Feedback",
        "faderPlusShiftDescription": "Echo feedback retention (quadratic curve).",
        "faderPlusFnTitle": "Interval",
        "faderPlusFnDescription": "Pitch shift per repeat; moving Third this hold blocks long panic.",
        "fnTitle": "Mute / panic",
        "fnDescription": "Short: mute (ring-out). Long: panic unless Third moved this hold.",
        "ledTop": "Delay meter + Out A activity (Ping-Pong)",
        "ledBottom": "Delay meter low half + Out B pulse (Ping-Pong)"
      }
    ],
    "params": [
      "I/O",
      "Delay mode",
      "Max delay (ms)",
      "Interval mode",
      "Routing",
      "Signal",
      "Range",
      "Color",
      "MIDI In",
      "MIDI In CH",
      "MIDI Out",
      "MIDI Out",
      "MIDI Out Pong",
      "MIDI CC",
      "MIDI Note"
    ],
    "storage": [
      "delay_saved",
      "feedback_saved",
      "interval_saved",
      "muted"
    ]
  },
  {
    "appId": 110,
    "title": "Control Issues",
    "description": "Shape CV and send it as MIDI control",
    "icon": "attenuate",
    "color": "Pink",
    "text": "Control Issues shapes CV (linear, log, exp, S-curve, rectify, fold) and sends MIDI CC or NRPN. Supports slew, quantization, and gate or continuous input modes.\n\n#### Cheatsheet\n- 1-channel CV→MIDI sculptor\n- Defaults are transparent: +100 % att, 0 offset, 0 slew, Linear, full CC window, 100 Hz\n- **Gate mode** — Schmitt threshold (**Gate Threshold** param, 0.1 V hysteresis), then the same pipeline\n- **Mute** — sends Output Min once and goes silent; unmute resends the live value\n- Fader LEDs show the shaped output; the **button** LED blinks briefly on transport downbeat when clock is running\n\n#### Faders\n- **Main** — Attenuverter −100…+100 % (center deadband = 0)\n- **Shift+Fader** — Offset\n- **Button+Fader** — Slew time\n\n#### Buttons\n- **Short** — Mute toggle\n- **Shift+Hold** — Momentary bypass (Range / Min–Max / Rate stay active)\n\n#### Params and LEDs\n- **Main**: output window on Top/Bottom; **Alt**: red offset; **Third**: cyan slew on Top only",
    "channels": [
      {
        "jackTitle": "CV In",
        "jackDescription": "Bipolar or unipolar CV in only — shaped to MIDI CC/NRPN.",
        "faderTitle": "Attenuverter",
        "faderDescription": "Main layer — scales CV ±100 % before offset / transfer / slew.",
        "faderPlusShiftTitle": "Offset",
        "faderPlusShiftDescription": "Bipolar offset after attenuverter.",
        "faderPlusFnTitle": "Slew",
        "faderPlusFnDescription": "Slew time toward the target value.",
        "fnTitle": "Mute",
        "fnDescription": "Short tap mute. Shift+hold = momentary bypass.",
        "ledTop": "Output level (Main) or offset / slew layers",
        "ledBottom": "Output low half (Main layer only)"
      }
    ],
    "params": [
      "Input Mode",
      "Range",
      "Transfer",
      "Slew Mode",
      "Steps",
      "Output Min",
      "Output Max",
      "Gate Threshold",
      "MIDI Rate",
      "MIDI Channel",
      "MIDI CC",
      "MIDI NRPN",
      "MIDI Out",
      "Color"
    ],
    "storage": [
      "att_saved",
      "offset_saved",
      "slew_saved",
      "muted"
    ]
  },
  {
    "appId": 111,
    "title": "Venn",
    "description": "Dual Euclidean layers + boolean logic; scale-aware melody via Extent",
    "icon": "euclid",
    "color": "Cyan",
    "text": "Two independent Euclidean masks combined with boolean logic — the OXI GEN dual-layer idea with a scale-aware melodic line. Color sets Layer A; Layer B LEDs use a fixed complement. Btn1 shows logic mode, not Color. Different lengths per layer enable polyrhythmic XOR/AND patterns Euclid cannot make alone.\n\n#### Melody\n- **Note A** — degree 0 of the device quantizer key\n- **Extent** — arch span in scale degrees through Length-A\n- **Interval B** — diatonic steps above that line for Ch2 (wire indices 0–12 unchanged)\n- Extent 0 = monotone Note A\n- Venn always draws its degrees from the device Scale\n\n#### Clock and probability\n- Needs clock\n- **Prob %** < 100 adds optional flakiness; 100 is fully deterministic\n- No pitch CV (use GenSeq for that)\n\n#### Follow device tonic\n- Default **on** — hold the Scene button and move Fader 5 and both lines transpose, together with Bassment, Contura, Chord Vamp and Arp de Lévy\n- Pitch class comes from the device; octave stays with MIDI Note A\n- Change lands at the start of the next A-cycle, not mid-pattern\n\n#### Faders\n- **Main** — F0 pulses A · F1 pulses B (density; absolute pulse count, Bjorklund redistributes)\n\n#### Buttons\n- **Shift+Btn2** — Toggle post-logic invert (shadow); white↔none fade like Heat Pump",
    "channels": [
      {
        "jackTitle": "Logic out",
        "jackDescription": "Gate + scale-aware melodic MIDI (Note A + degree arch) for the primary boolean result",
        "faderTitle": "Pulses A",